space,2024-01-01,The universe is under no obligation to make sense to you.
space,2024-01-02,Somewhere, something incredible is waiting to be known.
space,2024-01-03,The cosmos is within us. We are made of star stuff.
space,2024-01-04,Every atom in your body came from a star that exploded.
space,2024-01-05,The nitrogen in our DNA and the calcium in our teeth are remnants of stars that lived and died before our sun was born.
space,2024-01-06,The universe is not required to be in perfect harmony with human ambition.
space,2024-01-07,Looking up at the stars, I know quite well that, for all they care, I can go to bed.
space,2024-01-08,The sky calls to us. If we do not destroy ourselves, we will one day venture to the stars.
space,2024-01-09,For small creatures such as we, the vastness of the universe is bearable only through love.
space,2024-01-10,The surface of the Earth is the shore of the cosmic ocean.
space,2024-01-11,Across the sea of space, the stars are other suns.
space,2024-01-12,The universe is a pretty big place. If it is just us, seems like an awful waste of space.
space,2024-01-13,We are a way for the cosmos to know itself.
space,2024-01-14,Astronomy compels the soul to look upward and leads us from this world to another.
space,2024-01-15,Two possibilities exist: either we are alone in the universe or we are not. Both are equally terrifying.
space,2024-01-16,Space exploration is a force of nature unto itself that no other force in society can rival.
space,2024-01-17,The universe doesn't owe us an explanation. That's what makes discovery so thrilling.
space,2024-01-18,Saturn's rings are made of ice and rock and spin around the planet at remarkable speeds.
space,2024-01-19,Light from a distant star left its source thousands of years before it reached our eyes.
space,2024-01-20,Black holes are where space and time as we understand them cease to exist.
space,2024-01-21,A neutron star packs more mass than our sun into a sphere the size of a city.
space,2024-01-22,The Milky Way galaxy contains hundreds of billions of stars, and we have found only a fraction of them.
space,2024-01-23,Mars once had liquid water flowing across its surface, sculpting canyons and riverbeds now preserved in stone.
space,2024-01-24,Jupiter's Great Red Spot is a storm that has raged for hundreds of years.
space,2024-01-25,Voyager 1 has traveled farther from Earth than any other human-made object in history.
space,2024-01-26,The cosmic microwave background is an echo of the Big Bang still faintly glowing today.
space,2024-01-27,Dark matter makes up most of the mass of the universe yet has never been directly observed.
space,2024-01-28,Dark energy drives the accelerating expansion of space itself.
space,2024-01-29,Galaxies are islands of stars separated by unimaginable distances.
space,2024-01-30,The observable universe contains more stars than grains of sand on all of Earth's beaches.
space,2024-01-31,A supernova explosion outshines an entire galaxy for days.
space,2024-02-01,Pulsars are rotating neutron stars that emit beams of electromagnetic radiation with extraordinary precision.
space,2024-02-02,The International Space Station orbits Earth at roughly 28,000 kilometers per hour.
space,2024-02-03,Astronauts aboard the station experience sixteen sunrises and sixteen sunsets every day.
space,2024-02-04,The Apollo missions brought back lunar rocks that are older than any rock found on Earth.
space,2024-02-05,The Moon's gravity is responsible for the tides that shape coastlines around the world.
space,2024-02-06,Europa, a moon of Jupiter, may harbor a vast ocean beneath its icy crust.
space,2024-02-07,Enceladus, a moon of Saturn, ejects plumes of water vapor into space from hydrothermal vents.
space,2024-02-08,The James Webb Space Telescope can peer back to within a few hundred million years of the Big Bang.
space,2024-02-09,Hubble's images of the deep field revealed thousands of galaxies in a patch of sky smaller than a grain of sand.
space,2024-02-10,Exoplanets orbit stars beyond our solar system in numbers that stagger the imagination.
space,2024-02-11,The search for habitable worlds now drives much of modern astronomy.
space,2024-02-12,Comets are frozen remnants from the formation of the solar system, time capsules from the distant past.
space,2024-02-13,Asteroids in the belt between Mars and Jupiter are the building blocks of a planet that never formed.
space,2024-02-14,Gravitational waves, ripples in spacetime, were first detected in 2015 from merging black holes.
space,2024-02-15,The event horizon of a black hole is the point of no return, where escape becomes impossible.
space,2024-02-16,Quasars are the brightest objects in the universe, powered by supermassive black holes consuming matter.
space,2024-02-17,Nebulae are clouds of gas and dust where new stars are born and old stars die.
space,2024-02-18,The Crab Nebula is the remnant of a supernova explosion recorded by astronomers nearly a thousand years ago.
space,2024-02-19,Wolf-Rayet stars are among the most massive and luminous stars known, shedding their outer layers in fierce stellar winds.
space,2024-02-20,Red dwarf stars are the most common stars in the galaxy and may burn for trillions of years.
space,2024-02-21,Our sun is a middle-aged star roughly halfway through its ten-billion-year lifespan.
space,2024-02-22,In five billion years, the sun will expand into a red giant and engulf the inner planets.
space,2024-02-23,White dwarfs are the cooling remnants of stars that have shed their outer layers.
space,2024-02-24,The Andromeda Galaxy is on a collision course with the Milky Way and will arrive in about four billion years.
space,2024-02-25,The speed of light is the universal speed limit, roughly 300,000 kilometers per second.
space,2024-02-26,Even at the speed of light, reaching the nearest star would take over four years.
space,2024-02-27,Space is not empty. It is filled with radiation, magnetic fields, and a thin plasma of charged particles.
space,2024-02-28,The solar wind is a constant stream of charged particles flowing outward from the sun.
space,2024-02-29,Earth's magnetic field deflects the solar wind and protects the atmosphere from being stripped away.
space,2024-03-01,The northern lights are the visible result of charged particles from the sun striking Earth's atmosphere.
space,2024-03-02,Pluto was reclassified as a dwarf planet when astronomers discovered it shared its orbital neighborhood with many other icy bodies.
space,2024-03-03,The Kuiper Belt and the Oort Cloud are the distant reservoirs that send comets into the inner solar system.
space,2024-03-04,A day on Venus is longer than a year on Venus.
space,2024-03-05,Venus rotates in the opposite direction from most planets, so the sun rises in the west there.
space,2024-03-06,The atmosphere of Venus is thick with carbon dioxide, creating a runaway greenhouse effect.
space,2024-03-07,Mars has the tallest volcano in the solar system, Olympus Mons, three times the height of Everest.
space,2024-03-08,The Valles Marineris canyon system on Mars is long enough to stretch across the United States.
space,2024-03-09,Rovers on Mars have driven dozens of kilometers and conducted science experiments for decades.
space,2024-03-10,The Perseverance rover is collecting rock samples on Mars that may one day be returned to Earth.
space,2024-03-11,The Ingenuity helicopter demonstrated that powered flight is possible in the thin Martian atmosphere.
space,2024-03-12,Future human missions to Mars will face challenges from radiation, microgravity, and the long journey.
space,2024-03-13,Private companies are now launching rockets that return their boosters to the launchpad for reuse.
space,2024-03-14,Reusable rockets are dramatically lowering the cost of reaching orbit and opening up new possibilities.
space,2024-03-15,The dream of a self-sustaining city on Mars is driving a generation of engineers and entrepreneurs.
space,2024-03-16,Space telescopes operate above the blurring effects of Earth's atmosphere, revealing the universe in extraordinary detail.
space,2024-03-17,Radio telescopes listen for signals from deep in the galaxy that optical telescopes could never detect.
space,2024-03-18,The search for extraterrestrial intelligence is as much a philosophical endeavor as a scientific one.
space,2024-03-19,If life exists elsewhere in the universe, discovering it would be the most profound event in human history.
space,2024-03-20,The Fermi paradox asks why, in a universe this vast and old, we have not yet detected any signs of civilization.
space,2024-03-21,Every generation believes it is the first to truly understand the scale of the universe, and every generation is humbled anew.
space,2024-03-22,Looking at the night sky is an act of time travel. The stars you see are images from the past.
space,2024-03-23,Light from the most distant galaxies began its journey billions of years before Earth even existed.
space,2024-03-24,The universe is about 13.8 billion years old and still expanding in every direction.
space,2024-03-25,The question of what came before the Big Bang is one physics cannot yet answer.
space,2024-03-26,Space exploration teaches us about the universe and, in doing so, teaches us about ourselves.
space,2024-03-27,Every mission to a new world returns with questions that fuel the next generation of exploration.
space,2024-03-28,The thrill of discovery is the engine that drives science forward into the unknown.
space,2024-03-29,We are explorers by nature. The horizon has always called to us, and space is the ultimate horizon.
space,2024-03-30,To study the cosmos is to stand before a mirror in which we see the history of everything that ever was.
